<?xml version="1.0" encoding="UTF-8"?>
<xs:schema xmlns:xs="http://www.w3.org/2001/XMLSchema">
    <xs:element name="vonatjegyek">
        <xs:complexType>
            <xs:sequence>
                <xs:element name="allomas" type="allomasTipus" maxOccurs="unbounded" />
                <xs:element name="tavolsaga" type="tavolsagaTipus" maxOccurs="unbounded" />
                <xs:element name="vonat" type="vonatTipus" maxOccurs="unbounded" />
                <xs:element name="kocsi" type="kocsiTipus" maxOccurs="unbounded" />
                <xs:element name="erinti" type="erintiTipus" maxOccurs="unbounded" />
                <xs:element name="utas" type="utasTipus" maxOccurs="unbounded" />
                <xs:element name="jegy" type="jegyTipus" maxOccurs="unbounded" />
            </xs:sequence>
        </xs:complexType>

        <xs:key name="allomas">
            <xs:selector xpath="allomas" />
            <xs:field xpath="@aid" />
        </xs:key>

        <xs:keyref name="tavolsagaAllomas1" refer="allomas">
            <xs:selector xpath="tavolsaga" />
            <xs:field xpath="@aid1" />
        </xs:keyref>
        <xs:keyref name="tavolsagaAllomas2" refer="allomas">
            <xs:selector xpath="tavolsaga" />
            <xs:field xpath="@aid2" />
        </xs:keyref>

        <xs:key name="vonat">
            <xs:selector xpath="vonat" />
            <xs:field xpath="@vid" />
        </xs:key>

        <xs:key name="kocsi">
            <xs:selector xpath="kocsi" />
            <xs:field xpath="@kid" />
        </xs:key>
        <xs:keyref name="kocsiVonat" refer="vonat">
            <xs:selector xpath="kocsi" />
            <xs:field xpath="@vid" />
        </xs:keyref>

        <xs:keyref name="erintiVonat" refer="vonat">
            <xs:selector xpath="erinti" />
            <xs:field xpath="@vid" />
        </xs:keyref>
        <xs:keyref name="erintiAllomas" refer="allomas">
            <xs:selector xpath="erinti" />
            <xs:field xpath="@aid" />
        </xs:keyref>

        <xs:key name="utas">
            <xs:selector xpath="utas" />
            <xs:field xpath="@uid" />
        </xs:key>

        <xs:keyref name="jegyUtas" refer="utas">
            <xs:selector xpath="jegy" />
            <xs:field xpath="@uid" />
        </xs:keyref>
        <xs:keyref name="jegyVonat" refer="vonat">
            <xs:selector xpath="jegy" />
            <xs:field xpath="@vid" />
        </xs:keyref>
        <xs:keyref name="jegyAllomas1" refer="allomas">
            <xs:selector xpath="jegy" />
            <xs:field xpath="@aid1" />
        </xs:keyref>
        <xs:keyref name="jegyAllomas2" refer="allomas">
            <xs:selector xpath="jegy" />
            <xs:field xpath="@aid2" />
        </xs:keyref>

        <xs:keyref name="helyjegyKocsi" refer="kocsi">
            <xs:selector xpath="jegy/helyjegy" />
            <xs:field xpath="@kid" />
        </xs:keyref>
    </xs:element>

    <xs:complexType name="allomasTipus">
        <xs:sequence>
            <xs:element name="iranyitoszam" type="xs:integer" />
            <xs:element name="utca" type="xs:string" />
            <xs:element name="hazszam" type="xs:string" />
            <xs:element name="nev" type="xs:string" />
        </xs:sequence>

        <xs:attribute name="aid" type="xs:ID" use="required" />
    </xs:complexType>

    <xs:complexType name="tavolsagaTipus">
        <xs:sequence>
            <xs:element name="tavolsag" type="xs:integer" />
        </xs:sequence>

        <xs:attribute name="aid1" type="xs:IDREF" use="required" />
        <xs:attribute name="aid2" type="xs:IDREF" use="required" />
    </xs:complexType>

    <xs:complexType name="vonatTipus">
        <xs:sequence>
            <xs:element name="vonalszam" type="xs:integer" />
            <xs:element name="indulas" type="xs:dateTime" />
            <xs:element name="erkezes" type="xs:dateTime" />
            <xs:element name="tavolsag" type="xs:integer" />
            <xs:element name="helyjegy-koteles" type="xs:boolean" />
        </xs:sequence>

        <xs:attribute name="vid" type="xs:ID" use="required" />
    </xs:complexType>

    <xs:complexType name="kocsiTipus">
        <xs:sequence>
            <xs:element name="kocsiosztaly" type="xs:integer" />
        </xs:sequence>

        <xs:attribute name="vid" type="xs:IDREF" use="required" />
        <xs:attribute name="kid" type="xs:ID" use="required" />
    </xs:complexType>

    <xs:complexType name="erintiTipus">
        <xs:sequence>
            <xs:element name="vegallomas" type="xs:boolean" />
        </xs:sequence>

        <xs:attribute name="vid" type="xs:IDREF" use="required" />
        <xs:attribute name="aid" type="xs:IDREF" use="required" />
    </xs:complexType>

    <xs:complexType name="utasTipus">
        <xs:sequence>
            <xs:element name="nev" type="xs:string" />
            <xs:element name="email" type="xs:string" maxOccurs="unbounded" />
        </xs:sequence>

        <xs:attribute name="uid" type="xs:ID" use="required" />
    </xs:complexType>

    <xs:complexType name="jegyTipus">
        <xs:sequence>
            <xs:element name="ar" type="xs:integer" />
            <xs:element name="helyjegy" type="helyjegyTipus" minOccurs="0" />
        </xs:sequence>

        <xs:attribute name="jid" type="xs:ID" use="required" />
        <xs:attribute name="uid" type="xs:IDREF" use="required" />
        <xs:attribute name="vid" type="xs:IDREF" use="required" />
        <xs:attribute name="aid1" type="xs:IDREF" use="required" />
        <xs:attribute name="aid2" type="xs:IDREF" use="required" />
    </xs:complexType>

    <xs:complexType name="helyjegyTipus">
        <xs:sequence>
            <xs:element name="ulesszam" type="xs:integer" />
            <xs:element name="ar" type="xs:integer" />
        </xs:sequence>

        <xs:attribute name="kid" type="xs:IDREF" use="required" />
        <xs:attribute name="hid" type="xs:ID" use="required" />
    </xs:complexType>
</xs:schema>
