<?xml version="1.0" encoding="UTF-8" standalone="no"?>
<vonatjegyek xmlns:xs="http://www.w3.org/2001/XMLSchema-instance" xs:noNamespaceSchemaLocation="XMLSchemaKFIXBJ.xsd">
    <!-- Állomások -->
    <allomas aid="a1">
        <iranyitoszam>1087</iranyitoszam>
        <utca>Kerepesi út</utca>
        <hazszam>2-4.</hazszam>
        <nev>Budapest-Keleti</nev>
    </allomas>
    <allomas aid="a2">
        <iranyitoszam>3530</iranyitoszam>
        <utca>Kandó Kálmán tér</utca>
        <hazszam>1-3.</hazszam>
        <nev>Miskolc-Tiszai</nev>
    </allomas>
    <allomas aid="a3">
        <iranyitoszam>6700</iranyitoszam>
        <utca>Tisza Lajos körút</utca>
        <hazszam>28-30.</hazszam>
        <nev>Szeged</nev>
    </allomas>
    <allomas aid="a4">
        <iranyitoszam>7623</iranyitoszam>
        <utca>Indóház tér</utca>
        <hazszam>1.</hazszam>
        <nev>Pécs</nev>
    </allomas>
    <!-- Állomások távolsága -->
    <tavolsaga aid1="a1" aid2="a2">
        <tavolsag>294</tavolsag>
    </tavolsaga>
    <tavolsaga aid1="a1" aid2="a3">
        <tavolsag>324</tavolsag>
    </tavolsaga>
    <tavolsaga aid1="a1" aid2="a4">
        <tavolsag>340</tavolsag>
    </tavolsaga>
    <!-- Vonatok -->
    <vonat vid="v1">
        <vonalszam>1</vonalszam>
        <indulas>2022-11-29T08:00:00</indulas>
        <erkezes>2022-11-29T10:30:00</erkezes>
        <tavolsag>200</tavolsag>
        <helyjegy-koteles>false</helyjegy-koteles>
    </vonat>
    <vonat vid="v2">
        <vonalszam>2</vonalszam>
        <indulas>2022-11-29T09:00:00</indulas>
        <erkezes>2022-11-29T11:00:00</erkezes>
        <tavolsag>250</tavolsag>
        <helyjegy-koteles>true</helyjegy-koteles>
    </vonat>
    <vonat vid="v3">
        <vonalszam>3</vonalszam>
        <indulas>2022-11-29T11:00:00</indulas>
        <erkezes>2022-11-29T14:30:00</erkezes>
        <tavolsag>300</tavolsag>
        <helyjegy-koteles>true</helyjegy-koteles>
    </vonat>
    <!-- Kocsik -->
    <kocsi kid="k79" vid="v3">
        <kocsiosztaly>1</kocsiosztaly>
    </kocsi>
    <kocsi kid="k12" vid="v1">
        <kocsiosztaly>1</kocsiosztaly>
    </kocsi>
    <kocsi kid="k13" vid="v1">
        <kocsiosztaly>2</kocsiosztaly>
    </kocsi>
    <kocsi kid="k14" vid="v1">
        <kocsiosztaly>2</kocsiosztaly>
    </kocsi>
    <kocsi kid="k44" vid="v2">
        <kocsiosztaly>1</kocsiosztaly>
    </kocsi>
    <kocsi kid="k45" vid="v2">
        <kocsiosztaly>1</kocsiosztaly>
    </kocsi>
    <kocsi kid="k46" vid="v2">
        <kocsiosztaly>2</kocsiosztaly>
    </kocsi>
    <kocsi kid="k76" vid="v3">
        <kocsiosztaly>1</kocsiosztaly>
    </kocsi>
    <kocsi kid="k77" vid="v3">
        <kocsiosztaly>1</kocsiosztaly>
    </kocsi>
    <kocsi kid="k78" vid="v3">
        <kocsiosztaly>2</kocsiosztaly>
    </kocsi>
    <!-- Vonatok állomásai -->
    <erinti aid="a4" vid="v3">
        <vegallomas>true</vegallomas>
    </erinti>
    <erinti aid="a1" vid="v1">
        <vegallomas>true</vegallomas>
    </erinti>
    <erinti aid="a2" vid="v1">
        <vegallomas>false</vegallomas>
    </erinti>
    <erinti aid="a3" vid="v1">
        <vegallomas>true</vegallomas>
    </erinti>
    <erinti aid="a1" vid="v2">
        <vegallomas>true</vegallomas>
    </erinti>
    <erinti aid="a2" vid="v2">
        <vegallomas>false</vegallomas>
    </erinti>
    <erinti aid="a3" vid="v2">
        <vegallomas>false</vegallomas>
    </erinti>
    <erinti aid="a4" vid="v2">
        <vegallomas>true</vegallomas>
    </erinti>
    <!-- Utasok -->
    <utas uid="u1">
        <nev>Szőke Alex</nev>
        <email>szalex@email.com</email>
        <email>szoke.alex@email.com</email>
    </utas>
    <utas uid="u2">
        <nev>Farkas Blanka</nev>
        <email>fblanka@email.com</email>
    </utas>
    <utas uid="u3">
        <nev>Boros Máté</nev>
        <email>boros.mate@email.com</email>
        <email>bmate@email.com</email>
    </utas>
    <utas uid="u4">
        <nev>Pap Hanna</nev>
        <email>phanna@email.com</email>
        <email>pap.hanna@email.com</email>
    </utas>
    <!-- Jegyek -->
    <jegy aid1="a1" aid2="a2" jid="j1" uid="u1" vid="v1">
        <ar>800</ar>
    </jegy>
    <jegy aid1="a2" aid2="a4" jid="j2" uid="u2" vid="v3">
        <ar>750</ar>
        <helyjegy hid="h1" kid="k76">
            <ulesszam>12</ulesszam>
            <ar>150</ar>
        </helyjegy>
    </jegy>
    <jegy aid1="a3" aid2="a4" jid="j3" uid="u4" vid="v2">
        <ar>800</ar>
    </jegy>
</vonatjegyek>
